{
  "adjudication_status": "machine_consistent_semantics_unknown",
  "artifact_kind": "persona_v3_ai_formula_cross_review",
  "assurance_class": "provisional_ai_cross_review",
  "disagreement": {
    "items": [],
    "status": "none_detected_on_mechanical_contract"
  },
  "execution_mode": "deterministic_review_harness",
  "human_claims": false,
  "human_reviewed": false,
  "invariant_summary": {
    "fail": 0,
    "invariants_hash": "sha256:a8b83262de81bf5cc8fd95ac1cf0ea677ebd26ab8e526434e8b0a68efc0aeea7",
    "pass": 8,
    "total": 8,
    "unknown": 0
  },
  "method_model_eligible": false,
  "persona_id": "master_aschenbrenner",
  "production_effect": "none",
  "production_eligible": false,
  "review_artifact_hash": "sha256:1fce7bd805e894d383d4f010733493cd62536fb6c20c46e1d5af82f967926856",
  "review_schema_hash": "sha256:1b0ef67aafb46755b5a8d4a20e4d40a3c16b7ee9466ad29e4cf978474aaa56cb",
  "review_subject": {
    "declared_derivation_evidence_hash": "sha256:f8b6d943e2936b2b7c281c83098f72ced75d897425e0ea0f45aff1e2948c0140",
    "declared_derivation_spec_hash": "sha256:8d76c65b8d0aee17eeaaa15d8ac53ccfd8ad8d079eeea237e3b8d23eedfd3d5e",
    "declared_input_schema_hash": "sha256:841a04d5dcb54b3336ba8eee846fa64c99f4a7950fedb19693536dcd5f22865c",
    "declared_output_schema_hash": "sha256:8917b50c04a72b77622eb20ca4e40a5ef38a7c0c12c41ec8044a6d488eaacf84",
    "derivation_evidence_content_hash": "sha256:f8b6d943e2936b2b7c281c83098f72ced75d897425e0ea0f45aff1e2948c0140",
    "derivation_spec_hash": "sha256:8d76c65b8d0aee17eeaaa15d8ac53ccfd8ad8d079eeea237e3b8d23eedfd3d5e",
    "formula_compilation_hash": "sha256:18729c8e10a9fb20a4e658a0eb522440e94b9d3518c82a11aa879ebe3e6e0e58",
    "formula_content_hash": "sha256:8e892abd2c1b503ecdea53d418b7082ae3e9d532a6b15bf7f329cd3ae11daa42",
    "persona_id": "master_aschenbrenner",
    "recomputed_input_schema_hash": "sha256:841a04d5dcb54b3336ba8eee846fa64c99f4a7950fedb19693536dcd5f22865c",
    "recomputed_output_schema_hash": "sha256:8917b50c04a72b77622eb20ca4e40a5ef38a7c0c12c41ec8044a6d488eaacf84",
    "review_schema_hash": "sha256:1b0ef67aafb46755b5a8d4a20e4d40a3c16b7ee9466ad29e4cf978474aaa56cb",
    "schema_version": 1,
    "tool_content_hash": "sha256:4d8b653033e69fc7a0bd419972d41d4a7778b18a3c3359886a3a24bfddbbc94b",
    "tool_id": "master_aschenbrenner.market_capitalisation"
  },
  "review_subject_hash": "sha256:13be7a2449e51e8c7bc70b7b6c093216c601c0e013b585dab3f8a6e3986b1e0b",
  "reviewer_kind": "ai",
  "role_artifact_hashes": {
    "adjudicator": "sha256:6c83248a5033c4b71b745900d13234b1d36a947832106961e726e01b3f8d321b",
    "adversarial_checker": "sha256:a9d8f9182c9ac7f09aa422068eea89d2350528d7e9e92b325c12e6dc4063ae15",
    "deriver": "sha256:98144e8ab16929b5e509239c3393ede8d96686aef7eb714911a33049c870dbf3"
  },
  "role_sequence": [
    "deriver",
    "adversarial_checker",
    "adjudicator"
  ],
  "roles": {
    "adjudicator": {
      "artifact_hash": "sha256:6c83248a5033c4b71b745900d13234b1d36a947832106961e726e01b3f8d321b",
      "human_principal": false,
      "machine_actor_id": "alphacouncil.machine.adjudicator.v1",
      "prompt_hash": "sha256:a04bd88ee1b51c8b011e96de7513c14dcf3ba2417b0c13773d40996dfd831818",
      "prompt_id": "ai_formula_adjudicator_v1",
      "prompt_text": "Compare the two machine records and adjudicate mechanical consistency only. Semantic fidelity to a named investor remains unknown without source and human review; production eligibility must remain false.",
      "result": {
        "bound_adversarial_checker_artifact_hash": "sha256:a9d8f9182c9ac7f09aa422068eea89d2350528d7e9e92b325c12e6dc4063ae15",
        "bound_deriver_artifact_hash": "sha256:98144e8ab16929b5e509239c3393ede8d96686aef7eb714911a33049c870dbf3",
        "disagreements": [],
        "human_review_disposition": "not_performed",
        "mechanical_consistency": "pass",
        "production_disposition": "not_eligible",
        "semantic_fidelity": "unknown",
        "status": "machine_consistent_semantics_unknown",
        "unknowns": [
          "semantic_equivalence_to_named_investor_method",
          "appropriateness_of_first_declared_input",
          "appropriateness_of_output_as_decision_signal",
          "source_doctrine_fidelity"
        ]
      },
      "reviewer_kind": "ai",
      "role_id": "adjudicator",
      "subject_hash": "sha256:13be7a2449e51e8c7bc70b7b6c093216c601c0e013b585dab3f8a6e3986b1e0b"
    },
    "adversarial_checker": {
      "artifact_hash": "sha256:a9d8f9182c9ac7f09aa422068eea89d2350528d7e9e92b325c12e6dc4063ae15",
      "human_principal": false,
      "machine_actor_id": "alphacouncil.machine.adversarial_checker.v1",
      "prompt_hash": "sha256:02be6f66cac180e9807ff7dd01d530517c8904a4a93002c6840f2c6fd24e190c",
      "prompt_id": "ai_formula_adversarial_checker_v1",
      "prompt_text": "Independently recompute schema hashes, evidence hashes, test vectors, missing-input behavior, and invariants. Record disagreement or unknown explicitly; never trust the deriver result by assertion.",
      "result": {
        "bound_deriver_artifact_hash": "sha256:98144e8ab16929b5e509239c3393ede8d96686aef7eb714911a33049c870dbf3",
        "disagreements": [],
        "independently_recomputed_schema_hashes": {
          "input_schema_hash": "sha256:841a04d5dcb54b3336ba8eee846fa64c99f4a7950fedb19693536dcd5f22865c",
          "output_schema_hash": "sha256:8917b50c04a72b77622eb20ca4e40a5ef38a7c0c12c41ec8044a6d488eaacf84"
        },
        "independently_recomputed_vectors": [
          {
            "expected": {
              "error_code": null,
              "status": "computed",
              "value": 43.5
            },
            "recomputed": {
              "error_code": null,
              "status": "computed",
              "value": 43.5
            },
            "status": "pass",
            "vector_id": "finite_negative"
          },
          {
            "expected": {
              "error_code": null,
              "status": "computed",
              "value": 0
            },
            "recomputed": {
              "error_code": null,
              "status": "computed",
              "value": 0
            },
            "status": "pass",
            "vector_id": "finite_zero_boundary"
          },
          {
            "expected": {
              "error_code": null,
              "status": "computed",
              "value": 199.125
            },
            "recomputed": {
              "error_code": null,
              "status": "computed",
              "value": 199.125
            },
            "status": "pass",
            "vector_id": "finite_positive"
          },
          {
            "expected": {
              "error_code": "MISSING_INPUT",
              "status": "uncomputable",
              "value": null
            },
            "recomputed": {
              "error_code": "MISSING_INPUT",
              "status": "uncomputable",
              "value": null
            },
            "status": "pass",
            "vector_id": "missing_first_input"
          }
        ],
        "invariants": [
          {
            "evidence": "sha256:841a04d5dcb54b3336ba8eee846fa64c99f4a7950fedb19693536dcd5f22865c",
            "invariant_id": "input_schema_hash_exact",
            "status": "pass"
          },
          {
            "evidence": "sha256:8917b50c04a72b77622eb20ca4e40a5ef38a7c0c12c41ec8044a6d488eaacf84",
            "invariant_id": "output_schema_hash_exact",
            "status": "pass"
          },
          {
            "evidence": "sha256:f8b6d943e2936b2b7c281c83098f72ced75d897425e0ea0f45aff1e2948c0140",
            "invariant_id": "derivation_evidence_hash_exact",
            "status": "pass"
          },
          {
            "evidence": "sha256:8d76c65b8d0aee17eeaaa15d8ac53ccfd8ad8d079eeea237e3b8d23eedfd3d5e",
            "invariant_id": "derivation_spec_hash_exact",
            "status": "pass"
          },
          {
            "evidence": "sha256:e3afdf042563153241e32a7168cf0d6fc650269166ca507c3722a576f96dccb0",
            "invariant_id": "formula_tool_contract_exact",
            "status": "pass"
          },
          {
            "evidence": "sha256:0589f03dfea8081d3c332d83f406926ac3bd22e7d6a51d133a5ac8bf100ffd2c",
            "invariant_id": "test_vectors_recompute_exact",
            "status": "pass"
          },
          {
            "evidence": "fail",
            "invariant_id": "missing_input_fails_closed",
            "status": "pass"
          },
          {
            "evidence": "zero_human_zero_signature_non_production",
            "invariant_id": "provisional_boundary_intact",
            "status": "pass"
          }
        ],
        "production_disposition": "not_eligible",
        "status": "mechanically_consistent",
        "unknowns": [
          "semantic_equivalence_to_named_investor_method",
          "appropriateness_of_first_declared_input",
          "appropriateness_of_output_as_decision_signal",
          "source_doctrine_fidelity"
        ]
      },
      "reviewer_kind": "ai",
      "role_id": "adversarial_checker",
      "subject_hash": "sha256:13be7a2449e51e8c7bc70b7b6c093216c601c0e013b585dab3f8a6e3986b1e0b"
    },
    "deriver": {
      "artifact_hash": "sha256:98144e8ab16929b5e509239c3393ede8d96686aef7eb714911a33049c870dbf3",
      "human_principal": false,
      "machine_actor_id": "alphacouncil.machine.deriver.v1",
      "prompt_hash": "sha256:17ddd3b71249532283b685d40b3cae51745eaaf96e4c24fab1f4d6c8f26dedbb",
      "prompt_id": "ai_formula_deriver_v1",
      "prompt_text": "Re-derive test expectations only from the hash-bound DSL formula and executable contracts. Preserve unknown semantic fidelity and never issue a human or production approval.",
      "result": {
        "executable_contract_hash": "sha256:5bb7434341d7d2127f363cb602a0b607ab4b7825e689cf78c8a3b841b8501e86",